{
  "schema_version": "1.0.0",
  "query_id": "query-system-capability-surface",
  "ordering_strategy": "canonical",
  "scope": {
    "named_graph_scope": "system"
  },
  "result_count": 1,
  "triples": [
    {
      "ordinal": 0,
      "subject": "nostra://space/research",
      "predicate": "has_capability",
      "object": "nostra://capability/graph-query",
      "graph_scope": "system",
      "provenance_scope": "system",
      "source_ref": "nostra://event/system/capability-graph-query",
      "confidence": 0.99
    }
  ]
}
